,feedback,rating
3744,"First of all, his office stinks of mildew.  This QUACK should be ashamed to call himself a doctor.  I have never been to a doctor who puts a plumbing problem in ""a building which he owns"" before his patients.  I went to get some treatment for several injuries from a fall, and he actually had the nerve  to tell me that he didn't have time for this, (because of the leak in his building) just tell him what was bothering me the most.

The guy is an animal = STAY AWAY!!!",Rated 1 out of 5
3743,"Waited over 2 hrs. in the office, however, staff was very friendly. Dr. was very nice but did not have the needed support for my injury (brace) because I have a wide calf and gave me a script to call various medical supply stores which did not have it. He also did not provide adequate information as to how bad the injury was and for management of the injury for the first few weeks.  Went to another doctor and got the support my injury needed in the office and a very concrete plan of action.",Rated 1 out of 5
3742,"Horrible. Dr. Pearlman was very dismissive and rude. He used a lot of jargons and when you ask him questions, he refuses to answer them. WAITED OVER THREE HOURS. I made an appointment and still waited. They overbook to make money off of patients. They do not respect people’s time. When you complain, they shrug. Dr. Pearlman thinks he is a know it all and has a cocky attitude.  ",Rated 1 out of 5
3741,5 hours waiting time. No matter patients walk-in or by appointment. No bathroom in a doctor office!,Rated 1 out of 5
3740,"I am quite sure that as a surgeon, he is extremely proficient. However, his bedside manner leaves much to be desired, he jumps to conclusions before considering all of the information, he behaves in an arrogant manner which is very offputting and will not address more than one issue in a visit (even if the other issues are orthopedic in nature and are interrelated or have impact on the issue that you have as a primary focus). I prefer to be treated by a physician that sees me as a whole person and not just an extremity or painful joint. His office staff was pleasant enough and one could see that they were working very hard and seemed quite stressed by the patient load that needed attention. At least they were kind to me - he was not.",Rated 1 out of 5
3739,"It was the worst experience in my life I waited 3 hours and finally he see's me for about 10 minutes he refused to give me any medications for my legs pain.the staff they were very rude and unfriendly I will never go to this doctor again.
Do your self a favor don't go to this doctor.",Rated 1 out of 5
3738,Not at all likely,Rated 1 out of 5
3737,Waited over 3 hours in waiting room. Then waited another 1/2 hour in the examination room. Only interested in compensation cases where people see a doctor on the work clock. Total disregard for  patience's who are paying with insurance. Office staff just dumb. Would not see Dr. Pearlman again.,Rated 1 out of 5
3735,"arrogrant awful doctormy first visit i was given a 12:30 appointment. when i got there 15 people were waiting. they booked 15 people for 12:30. i was not taken until 2:30. a 5 minute visit after waiting. i have never experience such blatant disregard for a patient. he took xrays and didnt know what was wrong. i was given an referral for ct scan. i had a 2nd appointment for him to read scan. again a 12:30 appt. again waited 2 1/2 hours for a 5 minute visit to read results. after again aftr 2 1/2 hours i walked out. i have never was treated so poorly  by a doctor and staff. i don't have results and i'm in severe pain. my doctors and i have many never make me wait more then 5-10 minutes for my visit. this doctor is unplesant and i think he should be a garbage man. i had a stroke in 2018 and i have a form of muscular dystrophy called Myastenia Gravis.
i'm not well. he has total disregard for his patients. i gave a 1 star rating because there is not a minus column.
",Rated 1 out of 5
3734,"Terrible patient treatment This doctor has complete disregard for patients. He arrives 1 hour late to work making 10 patients in waiting room wait.  Appointment was 2 1/2 hours late. 
 After surgery there was no number to call in case of any questions or concerns.  I have never experience such terrible patient care. ",Rated 1 out of 5
3732,"At my husband’s appt, Dr. stood by door, gave us test results & answ quest but guess allowed to ask only a few, then walked out as my husband was talking! How rude... At fr. desk for a script my husband had a restriction quest, worker looked for Dr but ret’d saying write it down & we’ll get back to u. As he was writing, Dr. started to enter, saw us & jumped back behind the wall! Ofc worker nearby asked what‘s wrong?, laughed & looked at us. Dr jumped back across doorway to avoid us! Wow.....",Rated 1 out of 5
3731,Every time you contact the office to make an appointment they either hang up   And ignore or phone call messages and online they never respond back to you and then you leave a message they never get back to you no matter how much of a Urgent it is I contact them seven times I passed by the office they say you have to call to make an appointment  Or he’s not taking any new patients right now,Rated 1 out of 5
3892,"This office only has one assistant, who is rude and nasty.  This assistant runs the front end of the office, preps the rooms for the patients (including the injections) and does all the approvals for the procedures and answers calls.  The wait time to see Dr. Yun can run upwards to an hour (and this is with an appointment).  The wait time to get a report, that is already in the chart is upwards to 3 hours, no joke! Three hours sitting there in the waiting room for the assistant to just copy the ",Rated 1 out of 5
3895,"Avoid at all cost. Does not listen to you, does not care what you have to say or feel. Looks at you as if you were an insect that needed to be eradicated. Should not be in a position he is in! He forgot what the phrase: ""first, do not harm"" stands for.
",Rated 1 out of 5
3896,"The worst doctor so rude, I had surgery with him nightmare ",Rated 1 out of 5
4087,"This has been the most unsatisfying experience I have ever had with a Doctor (EVER). First off, I sat in the examination room for 45 minutes while he complained to the receptionist about some gardener that was over charging him..  He has a very thick accent and mumbles... Then I was told that I would need to set up therapy since I was denied an MRI. Fine, whatever needs to be done to fix my arm so I can grab my child.. Come to find out, HE the doctor denied me and I was never told! THE WORST!",Rated 1 out of 5
4064,"My life has changed drastically since my operation in 2010..
I have been in pain everyday of my life since ..
6 weeks after operation..DVT & massive pulmonary embolism
cannot walk properly..my whole foot has changed shape ..
Can only wear shoes with zippers..and sandals..
The list is long..
Prognosis..very good 
Outcome Very Poor
",Rated 1 out of 5
4062,"A very snarky and condescending man with only an interest in numbers.  He made no effort to communicate with me at all, which I think is in violation of his professional ethics.  I am looking into making a complaint against him with his licensing board.  Really, steer clear of this guy if you're the type of patient who wants to be treated with respect.",Rated 1 out of 5
4061,If you want to see a doctor who wont actually take the time to listen and answer questions n one whose bedside manners suck n loved to rush through appointments look no further he is the one you want. (Sarcasm),Rated 1 out of 5
4060,"Horrible 
He is worried about stats.
He plays the part very well
I would rated him zero",Rated 1 out of 5
4059,"Saw him in Forest Hills office. I have pain in right shoulder. He barely looked at my shoulder and when I complained of pain when moving arm in a certain way, he told me not to move it that way! I asked about x-ray and/or MRI. NO!

I then went to another doctor who immediately took x-rays and when pain continued after he prescribed physical therapy, he took MRI. I have tears in rotator cuff and other problems. Yang would not do any tests or PT. Thank God that I chose another doctor. Avoid Yang!",Rated 1 out of 5
4055,"This doctor ruined my life. When he did my hip replacement surgery he made my leg 11/2 inches longer. now it's hard for me to walk, i have constant pain, am unstable , have to buy ugly specially made shoes. iI can't walk barefoot or wear sandals..  He is  a bad doctor  and a  bad person.








",Rated 1 out of 5
4052,Perhaps the worst orthopedist and office staff there is. Their time management is AWFUL. I should not have to wait 2 hrs for my appointment. Why is my time not valuable to you? The doctors bedside manner was terrible. There’s no redeeming qualities except for the location. Read the reviews. This joke of an orthopedist has a malpractice claim too.,Rated 1 out of 5
4048,"it was good at first, till he changed on me. after having hip surgery and 2 months had past. I  had told him I was still in pain. He then tells me, there nothing I can do for me, you will be in pain for the rest of you life. He also tells me, I can go for a second opinion. feeling lost and thinking, that he maybe right. I decided, to go and get a second opinion. while  doing so, they have found a another tear on my hip. had I listen to his judgment I would have been living with this tear ",Rated 1 out of 5
4045,"As a a new patient I didn't feel welcome at all. The lady sitting at the front desk don't even look at you.  I had to find a sign in list by myself. I sat in the waiting area, but no one took care of the list. After 25 minutes I woke up, crossed out my name, and told one of the ladies I was canceling my appointment. 
Definitely not the place to be treated.",Rated 1 out of 5
4044,"This office does not return phone calls.  That goes for the staff and Dr Donadt.   I don't care how good a surgeon is, if the staff and surgeon can not be reached and there is not communication, that is poor patient care.  I have given Dr. Donadt many opportunities to prove me incorrect, but the situation is the same.   Horrible office.",Rated 1 out of 5
4042,"Dr. Lager misdiagnosed my torn achilles.  He told me that the tear was in a ""very rare sport at the myotendinous junction"" and that the tendon could not be repaired by surgery.  He was very pessimistic and lead me to believe that even once it healed non surgically, that there would be a high risk of re-rupture.  I got a second opinion from another doctor who stated that the tendon ruptured in a very normal spot and is ready to perform surgery.  He was also extremely rude.  Do not visit!!",Rated 1 out of 5
4041,poor bedside manner.  incompetent.  ,Rated 1 out of 5
4040,"Does not take time to treat the patient. Does not listen or read records properly causing misdiagnosis. I warn you to see someone else. This guy should have his license taken away. Unbelievable he’s aloud to treat anyone, he shouldn’t be allowed to diagnose a common cold.",Rated 1 out of 5
4038,IME Examination - Biased ExaminationDr. Lager is clearly only looking after his own interests and is failing to uphold his Hippocratic oath. I was injured while at work and suffered significant damage which was evident in follow up X-Rays and MRI's. I have a herniated disc in my neck and back in addition to a tear in one of my shoulders. All of this confirmed via imaging tests that were readily available for review by Dr. Lager and his team but he didn't bother to look. He brought me in a room for 10 minutes and tapped on multiple areas of my body asking what my pain levels were. He then checked for range of motion and said I need to follow up with an Orthopedic surgeon knowing full well that my medical insurance is in limbo pending the conclusion of my workers comp case. He acknowledged in the office that I needed further treatment but in his report for the claim he completely contradicted himself. I think Dr. Lager is confused and believes it's a Hypocritic oath because that's what his actions indicate.  ,Rated 1 out of 5
4036,"Had complete reconstructive surgery on both feet...RUN RUN RUN AWAY!  DONT let him near u in thebOR,  my feet are ruined...Can't walk without terrible pain, had 2 separate surgeries to try to correct the damage he inflicted!",Rated 1 out of 5
4086,"Worst doctor I have ever been too. I had a fluid in my knee last year and he drained it out. Not only did he stick a huge needle in me, he did it without me being aware. YES, he stuck the needle, which caused some of the fluid to have blood in it. Thats not all - He poured the rest of the specimen into a styrofoam cup and made my brother (who was with me) hold the specimen. Very unprofessional. I got no answers from him. A year later, I still have the same problem. Do not see Dr. Adibe. ",Rated 1 out of 5
4088,I have been a patient for many years.  The only plus is that he is an excellent surgeon BUT everything else is negative.  He constantly keeps canceling patient appointments.  The staff does not call when the appointments are canceled.  They sometimes call the night before your appointment to remind you.  He does not return calls.  It is hard to make appointments even when the patient considers the problem important weeks after surgery.,Rated 1 out of 5
4031,Dr. Sands disregarded the issue that brought me to him and recommended a complicated surgery. I had to go to a different doctor who read Dr. Sands report and acknowledged that he had seen similar recommendations from Dr. Sands for other patients.,Rated 1 out of 5
4089,Worst ever hospital experience.  Never saw him before or after the surgery after several requests.  They were hours behind.  The staff was mostly mean and uncaring.  They bombarded me with a stack of papers to sign with no time to read them while two people prodded my hands for an IV line and I was being interviewed via TV screen on hospital regulations.  After the epidural I was told to lift and move myself using my arms from gurney to operating table.  Then I woke up and it was over.  Scary.,Rated 1 out of 5
4329,"I am writing this to warn you! The office staff does not know what they are doing and will leave you stuck with a HUGE bill if you are not careful. 

I got a referral for an MRI- I made the MRI appointment, and when I did they had me call the office and ask for it to be faxed over.

The office said they faxed the MRI.

I take a half a day from work to finally get this MRI - I left work early (used half a day, that I can’t get back) 

I’m waiting at the hospital they never got the MRI- you will be billed for the MRI- do you know how much an MRI is?!?!

That’s okay- I called the doctors office. 

Person 1) you’re suppose to get the auth?! What? Me? I can’t do that!  That’s impossible! Why did you tell me you faxed it if you didn’t. 

Person 2) we will have it done, just wait until she gets it.  

Person 3) an hour later, what are you talking about. That girl you’re looking for doesn’t do auth!  WHAT?!?! 

Person 4) why did you wait since Dec to do the MRI?! Does it matter? You said you f",Rated 1 out of 5
4313," I was sent to him by three people but he terrified me when he told me that I needed an operation on four fingers or I would be “crippled” and he couldnt then help me. He made me a splint so uncomfortable that my hand, which didn’t hurt when I went to see him, began hurting terribly. I also asked to get a referral to pt but he said no. I got a second opinion from a more seasoned hand surgeon who told me that I am not nearly at the point of requiring surgery and that they were many Other options.",Rated 1 out of 5
4312,Frightening,Rated 1 out of 5
4294,First off I want to say that I'm not normally a review writer but this experience sent me over the edge. My daughter wakes up with back pain everyday. I scheduled an appointment with this doctor's office for my daughter to have an MRI SIX weeks out.  They call me two days prior to the appointment to cancel with complete disregard for the fact that we are traveling 3 hours for the appointment. Zero empathy. Zero accountability. I was told that their call center is untrained and does not know what procedures they offer. Corporate healthcare is the pits and this office exemplifies it. Get your stuff together.,Rated 1 out of 5
4272,"Performed an independent medical examination on me. Entire report full of lies, including the fact that the measuring equipment he claimed to use to evaluate range of motion were not present in the room!  Even put his hand behind my knee and threw up my leg when testing my reflexes.  Hippocratic Oath?  Really!?",Rated 1 out of 5
4266,Nasty receptionist who absolutely refused to help even thoigh I explained i was in pain. Terrible experience. Would never go back,Rated 1 out of 5
4262,"I read reviews and thought that this doctor is right for me. Scheduled appointment with him.
I can't barely walk and need a fast help. I was seen by his assistant for 2 minutes and was sent to MRI. When I ask when I could see doctor, I was told that assistant could read for me the MRI results. To safe time,just go to doctor who is ready to see you.",Rated 1 out of 5
4261,"I RETRACT MY  review  }I'M A 52 YEAR OLD WOMAN,,,commentary here for reasons that ARE MY TRUEST Opinion after the so called care received by myself. not all BODY PARTS that were injured were addressed . AND I will never leave commentary results for any dr. ever again until MY so called treatment is complete , I'm still in MASSIVE pain daily/ etc. i'm not bashing anyone i'm stating my opinion which are legal facts/ i'm not better , and my so called treatment wasn't complete / ........................... i' wish i never left the positive review as i should've waited... my treatment with this dr. leaves alot to be desired as my only end goal was to returen to my chosen career of over 3 decades , WHICH i cannot go back to , per ANOTHER DR. I'M 100% DISABLED TO EVER RETURN to my job there are too many facts etc. that are LEGAL and long story short in my opinion I would never have left that review surgey was done on 1 part of my body,, the rest NOT TAKEN CARE OF.. jeanie",Rated 1 out of 5
4231,Don’t see her. If you show up 5 minutes late she’ll cancel your appointment. Staff is rude as well. ,Rated 1 out of 5
4201,Smart kind and intelligent health smart drs who will do everything. They can to make you healthy.  They r the nicest people ,Rated 1 out of 5
4199,"Saw him 4 x’s.
He was overwhelmed by my needs from the start. I’m a multiple medical me.
He scheduled an EMG which helped me confirm suspected -grateful for.
The following appointments -downhill quick.
Whoever processes scripts is incompetent & there is no supervision or care to correct them.
Scripts sent wrong multiple times after multiple phone calls. Doctor did not want to be bothered with that problem. “That’s for my office staff to fix. Don’t bother me with this.” Nope it’s yours.
Fired!",Rated 1 out of 5
4198,"Disappointing and frustrating.  A truly horrible experience.  No follow up. 
 No care for the patient.  Despite five phone calls over the course of a month since my appointment where I was told I have a cyst, Dr. Varma has STILL not transcribed his notes to enable me to schedule my MRI which he recommended.  I have spent countless time on the phone with different office people, only to be told the same thing:  I'll make sure he gets this message.  It's a month later and I still have not been able to schedule my MRI.  Worst experience.",Rated 1 out of 5
4156,"Stay awayUnfortunately, the experience with this doctor was way below expectations. Dr. Jazrawi and his staff are not interested in the patients' well being. They will cancel appointments last second without providing any reasonable alternatives. There is no path to getting the patient batter but focus in bureaucratic procedures. Stay away.",Rated 1 out of 5
4107,with me he did not succeed in the operation.,Rated 1 out of 5
4090,"My experience with Dr. Touliopoulos has been horrible, wait time to see the Doctor (if you are lucky enough to see him in person) is between 1 to 2 hours. He did surgery on my knee, and never checked after me post surgery. I called the office to speak with him regarding my surgery without a call back. My 2 week visit, I was told Dr. Touliopoulos was late coming into the office and a different doctor saw me instead of him. Since surgery, I have not been able to see him once so far.",Rated 1 out of 5
4032,"I wish I had posted the year I had him do reconstructive surgery to my foot. I'm still having problems 7 years later. And, his beside manner was only funny before the surgery. In fact, I remember going about a year later to show him the problems and do you know what he said?? ""I can fix them""
NEVER excepting responsibility. ",Rated 1 out of 5
4027,Would not recommend this surgeonDr. Sands performed reconstructive surgery on my right foot.  The surgery did not go well. Had additional surgery to try and correct the error made with the first surgery but to no avail. Presently I now walk with a limp and require the assistance of a cane.  He has terrible bedside manner as does his staff.  Run don't walk away from this orthopedic surgeon,Rated 1 out of 5
3897,"This man disclosed my private medical history and discussed my personal information in a waiting room full of people at Doc Care # 3 in Queens NY. He was complaining about me loudly to the medical assistant in the waiting room, not knowing I was sitting there.  When I stood up and said something he told me he was sorry. I have reported him to HR immediatly in person and they said they are making a full report.  He admitted it freely to them also.  I am waiting to hear back from them.  ",Rated 1 out of 5
3948,"super fast examination, answered my question on his way out the door. best thing this Dr did for me was to pick up my cane when i accidentally dropped it.",Rated 1 out of 5
3939,"The visit was okay,  nothing special. The wait time is ridiculous. Get ready to wait 2-3hours from the appointment time. Won’t go again!",Rated 1 out of 5
3938,"Disgusting place, dr urban charges his patients to pay to get their workers comp and job forms s fee Of  25-40 dollars to fill out , if you don’t pay you will not get you forms back. The staff is rude ghetto and streetish they are slow and unprofessional manners, they walk out on you when your talking anc they stole a patient insurance card, the patient came back to the clinic and went off. The place is money hungry,  who and what clinic you know charges a fee to fill out health forms while we giving them our services, so embarrassing. Please close this place down DOM has to come out and investigate this horrible place, please I encourage no one to come to this dr, dr urban........",Rated 1 out of 5
3934,My mom went to this Doctor and she certainly had no bedside manners. If no stars was an option she wouldnt get any. ,Rated 1 out of 5
3933,"Waiting time is unreal! 1.5 hours and hadn't even gotten to see the Dr. yet? I had another appt. that day elsewhere, one I made based on logic I'd never spend that much time at a previous appt. at a Dr. for an Xray and Dr. consult? There were so many people in waiting room, with one Dr. on stuff that day, I saw writing on the wall and TELL TALE sign of overbooking and/or appt. lag. I had to leave after 1.5 hrs and Xray, BUT the staff looks at me as THAT was strange?! Hello? Ever hear of reality?",Rated 1 out of 5
3932,"VERY UNPROFESSIONAL  

I WAITED  IN A NON VENTILATED  ROOM (by the way am a severe  heart patient)
I waited two bloody hours for her to tell me she can't help me because she IS NOT EDUCATED IN MEDICAL DEVICES . .I TRIED TO LEAVE BUT SHE HELD MY MEDICAL CARD HOSTAGE..THINKING SHE KNOWS BETTER THEN THE PEOPLE  THAT IMPLANTED THE DEVICE IN THE FIRST PLACE
IF YOU HAVE A MEDICAL DEVICE IMPLANTED!
 -DO NOT GO TO HER.  READ ALL THE REVIEWS  ON THE WEB ABOUT HER -FIRST
MAKE YOU THINK TWICE",Rated 1 out of 5
3929,"Went to see Vitale after a jet ski accident. Didnt get to see the doctor himself instead saw one of his helpers. Her name was Lauren. She gave me an xray deemed there was no fracture in my ankle and diagnosised me with a severe sprained ankle, handed me an air cast and sent me on my way for a follow up visit in 3 weeks. While scheduling my followup visit the receptionist scheduled me for 2 weeks. So I return on my 2 week follow up, again dont see the docotr and see Laudren, her words back so so",Rated 1 out of 5
3928,"I was charged $100. Per minute! I went in with wrist pain, I receive a shot, $2000. later!
One of the charges was $450. For supplies and equipment!
",Rated 1 out of 5
3922,"Recently had xrays done here as follow-up to 2012 foot surgery by another doctor. Dr M compared the wrong year-to-year xrays and said nothing's changed, all's good, just some temporary bursitis. I then showed the CD w/ Dr M's xrays to my original surgeon who confirmed this week my foot condition had in fact changed and will require surgery. As a result I'm not at all confident about w/Dr M. Nice guy but RUSHED me through the whole visit, compared wrong xrays and misdiagnosed my foot pain",Rated 1 out of 5
3918,"Traveling 2+ hours each way for his expert care, he superficially examined only top side of my foot w/out removing bandage that was cushioning underside of foot that was causing the pain.  Insisted it was a neuroma and that only this NYU ultrasound people could effectively diagnose causing return 4hr trip next day only to confirm not a neuroma.  Called following week saying not a neuroma and to get it checked out locally since he didn't know what was causing pain in a foot he never examined.",Rated 1 out of 5
